{
  "schema": "operatebench.runtime_identity_adapter_census.v1",
  "schema_version": 1,
  "registry_schema": "operatebench.runtime_identity_adapter_registry.v1",
  "owners": [
    "operation_core_content",
    "semantic_scenario_content",
    "variant_content",
    "runtime_contract_content",
    "scaffold_content",
    "arm_protocol_content",
    "provider_run_plan_content",
    "build_provenance_content"
  ],
  "entries": [
    {
      "field_path": "/operation_card/schema",
      "owner": "operation_core_content",
      "source": "b1_operation_card_projector",
      "source_paths": [
        "examples/operatebench/maintenance_v0_1.yaml",
        "src/operatebench/domains/lettings/maintenance/retrieval.py",
        "src/operatebench/domains/lettings/maintenance/spec.py"
      ],
      "consumer": "runtime_manifest_binding",
      "nullability": "never",
      "cardinality": "exact"
    },
    {
      "field_path": "/operation_card/schema_version",
      "owner": "operation_core_content",
      "source": "b1_operation_card_projector",
      "source_paths": [
        "examples/operatebench/maintenance_v0_1.yaml",
        "src/operatebench/domains/lettings/maintenance/retrieval.py",
        "src/operatebench/domains/lettings/maintenance/spec.py"
      ],
      "consumer": "runtime_manifest_binding",
      "nullability": "never",
      "cardinality": "exact"
    },
    {
      "field_path": "/operation_card/id",
      "owner": "operation_core_content",
      "source": "b1_operation_card_projector",
      "source_paths": [
        "examples/operatebench/maintenance_v0_1.yaml",
        "src/operatebench/domains/lettings/maintenance/retrieval.py",
        "src/operatebench/domains/lettings/maintenance/spec.py"
      ],
      "consumer": "runtime_manifest_binding",
      "nullability": "never",
      "cardinality": "exact"
    },
    {
      "field_path": "/operation_card/content_digest_sha256",
      "owner": "operation_core_content",
      "source": "b1_operation_card_projector",
      "source_paths": [
        "examples/operatebench/maintenance_v0_1.yaml",
        "src/operatebench/domains/lettings/maintenance/retrieval.py",
        "src/operatebench/domains/lettings/maintenance/spec.py"
      ],
      "consumer": "runtime_manifest_binding",
      "nullability": "never",
      "cardinality": "exact"
    },
    {
      "field_path": "/operation_card/content/operation_type",
      "owner": "operation_core_content",
      "source": "b1_operation_card_projector",
      "source_paths": [
        "examples/operatebench/maintenance_v0_1.yaml",
        "src/operatebench/domains/lettings/maintenance/retrieval.py",
        "src/operatebench/domains/lettings/maintenance/spec.py"
      ],
      "consumer": "runtime_manifest_binding",
      "nullability": "never",
      "cardinality": "exact"
    },
    {
      "field_path": "/operation_card/content/operation_version",
      "owner": "operation_core_content",
      "source": "b1_operation_card_projector",
      "source_paths": [
        "examples/operatebench/maintenance_v0_1.yaml",
        "src/operatebench/domains/lettings/maintenance/retrieval.py",
        "src/operatebench/domains/lettings/maintenance/spec.py"
      ],
      "consumer": "runtime_manifest_binding",
      "nullability": "never",
      "cardinality": "exact"
    },
    {
      "field_path": "/operation_card/content/state_contract",
      "owner": "operation_core_content",
      "source": "b1_operation_card_projector",
      "source_paths": [
        "examples/operatebench/maintenance_v0_1.yaml",
        "src/operatebench/domains/lettings/maintenance/retrieval.py",
        "src/operatebench/domains/lettings/maintenance/spec.py"
      ],
      "consumer": "runtime_manifest_binding",
      "nullability": "never",
      "cardinality": "exact"
    },
    {
      "field_path": "/operation_card/content/authority_contract",
      "owner": "operation_core_content",
      "source": "b1_operation_card_projector",
      "source_paths": [
        "examples/operatebench/maintenance_v0_1.yaml",
        "src/operatebench/domains/lettings/maintenance/retrieval.py",
        "src/operatebench/domains/lettings/maintenance/spec.py"
      ],
      "consumer": "runtime_manifest_binding",
      "nullability": "never",
      "cardinality": "exact"
    },
    {
      "field_path": "/operation_card/content/policy_contract",
      "owner": "operation_core_content",
      "source": "b1_operation_card_projector",
      "source_paths": [
        "examples/operatebench/maintenance_v0_1.yaml",
        "src/operatebench/domains/lettings/maintenance/retrieval.py",
        "src/operatebench/domains/lettings/maintenance/spec.py"
      ],
      "consumer": "runtime_manifest_binding",
      "nullability": "never",
      "cardinality": "exact"
    },
    {
      "field_path": "/operation_card/content/event_contracts",
      "owner": "operation_core_content",
      "source": "b1_operation_card_projector",
      "source_paths": [
        "examples/operatebench/maintenance_v0_1.yaml",
        "src/operatebench/domains/lettings/maintenance/retrieval.py",
        "src/operatebench/domains/lettings/maintenance/spec.py"
      ],
      "consumer": "runtime_manifest_binding",
      "nullability": "never",
      "cardinality": "exact"
    },
    {
      "field_path": "/operation_card/content/action_contracts",
      "owner": "operation_core_content",
      "source": "b1_operation_card_projector",
      "source_paths": [
        "examples/operatebench/maintenance_v0_1.yaml",
        "src/operatebench/domains/lettings/maintenance/retrieval.py",
        "src/operatebench/domains/lettings/maintenance/spec.py"
      ],
      "consumer": "runtime_manifest_binding",
      "nullability": "never",
      "cardinality": "exact"
    },
    {
      "field_path": "/operation_card/content/retrieval_contract",
      "owner": "operation_core_content",
      "source": "b1_operation_card_projector",
      "source_paths": [
        "examples/operatebench/maintenance_v0_1.yaml",
        "src/operatebench/domains/lettings/maintenance/retrieval.py",
        "src/operatebench/domains/lettings/maintenance/spec.py"
      ],
      "consumer": "runtime_manifest_binding",
      "nullability": "never",
      "cardinality": "exact"
    },
    {
      "field_path": "/operation_card/content/transition_contract",
      "owner": "operation_core_content",
      "source": "b1_operation_card_projector",
      "source_paths": [
        "examples/operatebench/maintenance_v0_1.yaml",
        "src/operatebench/domains/lettings/maintenance/retrieval.py",
        "src/operatebench/domains/lettings/maintenance/spec.py"
      ],
      "consumer": "runtime_manifest_binding",
      "nullability": "never",
      "cardinality": "exact"
    },
    {
      "field_path": "/semantic_scenario_card/schema",
      "owner": "semantic_scenario_content",
      "source": "b1_semantic_scenario_card_projector",
      "source_paths": [
        "src/operatebench/domains/lettings/maintenance/semantic_arms_v1.py"
      ],
      "consumer": "runtime_manifest_binding",
      "nullability": "never",
      "cardinality": "exact"
    },
    {
      "field_path": "/semantic_scenario_card/schema_version",
      "owner": "semantic_scenario_content",
      "source": "b1_semantic_scenario_card_projector",
      "source_paths": [
        "src/operatebench/domains/lettings/maintenance/semantic_arms_v1.py"
      ],
      "consumer": "runtime_manifest_binding",
      "nullability": "never",
      "cardinality": "exact"
    },
    {
      "field_path": "/semantic_scenario_card/id",
      "owner": "semantic_scenario_content",
      "source": "b1_semantic_scenario_card_projector",
      "source_paths": [
        "src/operatebench/domains/lettings/maintenance/semantic_arms_v1.py"
      ],
      "consumer": "runtime_manifest_binding",
      "nullability": "never",
      "cardinality": "exact"
    },
    {
      "field_path": "/semantic_scenario_card/content_digest_sha256",
      "owner": "semantic_scenario_content",
      "source": "b1_semantic_scenario_card_projector",
      "source_paths": [
        "src/operatebench/domains/lettings/maintenance/semantic_arms_v1.py"
      ],
      "consumer": "runtime_manifest_binding",
      "nullability": "never",
      "cardinality": "exact"
    },
    {
      "field_path": "/semantic_scenario_card/content/operation_core",
      "owner": "semantic_scenario_content",
      "source": "b1_semantic_scenario_card_projector",
      "source_paths": [
        "src/operatebench/domains/lettings/maintenance/semantic_arms_v1.py"
      ],
      "consumer": "runtime_manifest_binding",
      "nullability": "never",
      "cardinality": "exact"
    },
    {
      "field_path": "/semantic_scenario_card/content/construct_label",
      "owner": "semantic_scenario_content",
      "source": "b1_semantic_scenario_card_projector",
      "source_paths": [
        "src/operatebench/domains/lettings/maintenance/semantic_arms_v1.py"
      ],
      "consumer": "runtime_manifest_binding",
      "nullability": "never",
      "cardinality": "exact"
    },
    {
      "field_path": "/semantic_scenario_card/content/common_estimand_id",
      "owner": "semantic_scenario_content",
      "source": "b1_semantic_scenario_card_projector",
      "source_paths": [
        "src/operatebench/domains/lettings/maintenance/semantic_arms_v1.py"
      ],
      "consumer": "runtime_manifest_binding",
      "nullability": "never",
      "cardinality": "exact"
    },
    {
      "field_path": "/semantic_scenario_card/content/decision_points",
      "owner": "semantic_scenario_content",
      "source": "b1_semantic_scenario_card_projector",
      "source_paths": [
        "src/operatebench/domains/lettings/maintenance/semantic_arms_v1.py"
      ],
      "consumer": "runtime_manifest_binding",
      "nullability": "never",
      "cardinality": "exact"
    },
    {
      "field_path": "/semantic_scenario_card/content/causal_graph",